<?xml version="1.0" encoding="ISO-8859-1"?>
<waet xmlns:xsi="http://www.w3.org/2001/XMLSchema-instance" xsi:noNamespaceSchemaLocation="test-schema.xsd">
    <setup interface="MUSHRA" projectReturn="save.php" randomiseOrder='true' poolSize="2" loudness="-23">
        <exitText>Thank you for looking at WAET. You can modify the successful completion text as well!</exitText>
        <survey location="before">
            <surveyquestion id="sessionId" mandatory="true">
                <statement>Please enter your name.</statement>
            </surveyquestion>
            <surveycheckbox id="checkboxtest" mandatory="true">
                <statement>Please select with which activities you have any experience (example checkbox question)</statement>
                <option name="musician">Playing a musical instrument</option>
                <option name="soundengineer">Recording or mixing audio</option>
                <option name="developer">Developing audio software</option>
                <option name="hwdesigner">Designing or building audio hardware</option>
                <option name="researcher">Research in the field of audio</option>
            </surveycheckbox>
            <surveystatement id="test-intro">
                <statement>This is an example of an 'MUSHRA'-style test, with two pages, using the test stimuli in 'example_eval/'.</statement>
            </surveystatement>
        </survey>
        <survey location="after">
            <surveyquestion id="location" mandatory="true" boxsize="large">
                <statement>Please enter your location. (example mandatory text question)</statement>
            </surveyquestion>
            <surveynumber id="age" min="0">
                <statement>Please enter your age (example non-mandatory number question)</statement>
            </surveynumber>
            <surveyradio id="rating">
                <statement>Please rate this interface (example radio button question)</statement>
                <option name="bad">Bad</option>
                <option name="poor">Poor</option>
                <option name="good">Good</option>
                <option name="great">Great</option>
            </surveyradio>
            <surveystatement id="thankyou">
                <statement>Thank you for taking this listening test. Please click 'Submit' and your results will appear in the 'saves/' folder.</statement>
            </surveystatement>
        </survey>
        <metric>
            <metricenable>testTimer</metricenable>
            <metricenable>elementTimer</metricenable>
            <metricenable>elementInitialPosition</metricenable>
            <metricenable>elementTracker</metricenable>
            <metricenable>elementFlagListenedTo</metricenable>
            <metricenable>elementFlagMoved</metricenable>
            <metricenable>elementListenTracker</metricenable>
        </metric>
        <interface>
            <interfaceoption type="check" name="fragmentMoved" />
            <interfaceoption type="check" name="scalerange" min="25" max="75" />
            <interfaceoption type="show" name="fragmentSort" />
            <interfaceoption type="show" name='playhead' />
            <interfaceoption type="show" name="page-count" />
            <interfaceoption type="show" name="volume" />
            <scales>
                <scalelabel position="12">Much Worse</scalelabel>
                <scalelabel position="25">Worse</scalelabel>
                <scalelabel position="38">Slightly Worse</scalelabel>
                <scalelabel position="50">About the same</scalelabel>
                <scalelabel position="62">Slightly Better</scalelabel>
                <scalelabel position="75">Better</scalelabel>
                <scalelabel position="88">Much Better</scalelabel>
            </scales>
        </interface>
    </setup>
    <page id='test-0' hostURL="media/example/" randomiseOrder='true' repeatCount='0' loop='true' loudness="-12" restrictMovement="true">
        <commentboxprefix>Comment on fragment</commentboxprefix>
        <interface>
            <scales>
                <scalelabel position="12">Much Worse</scalelabel>
                <scalelabel position="25">Worse</scalelabel>
                <scalelabel position="38">Slightly Worse</scalelabel>
                <scalelabel position="50">About the same</scalelabel>
                <scalelabel position="62">Slightly Better</scalelabel>
                <scalelabel position="75">Better</scalelabel>
                <scalelabel position="88">Much Better</scalelabel>
            </scales>
        </interface>
        <audioelement url="0.wav" id="track-0" type="anchor" />
        <audioelement url="1.wav" id="track-1" />
        <audioelement url="2.wav" id="track-2" />
        <audioelement url="3.wav" id="track-3" />
        <audioelement url="4.wav" id="track-4" />
        <survey location="before">
            <surveyentry type="statement" id="test-0-intro">
                <statement>Example of a 'MUSHRA' style interface with hidden anchor 'zero' (which needs to be below 20%), looping of the samples, randomisation of marker labels, mandatory moving of every sample, and a forced scale usage of at least 25%-75% using a Comparison Category Rating Scale.</statement>
            </surveyentry>
        </survey>
        <survey location="after">
            <surveyentry type="question" id="genre-0" mandatory="true">
                <statement>Please enter the genre.</statement>
            </surveyentry>
        </survey>
    </page>
    <page id='test-1' hostURL="media/example/" randomiseOrder='true' repeatCount='0' loop='false' restrictMovement="true">
        <commentboxprefix>Comment on fragment</commentboxprefix>
        <interface name="preference">
            <title>Example Test Question</title>
            <interfaceoption type="show" name="comments" />
            <scales>
                <scalelabel position="0">Min</scalelabel>
                <scalelabel position="100">Max</scalelabel>
                <scalelabel position="50">Middle</scalelabel>
                <scalelabel position="20">20</scalelabel>
            </scales>
        </interface>
        <audioelement url="0.wav" gain="-6.0" id="track-5" type="anchor" marker="20" />
        <audioelement url="1.wav" gain="0.0" id="track-6" type="reference" marker="80" />
        <audioelement url="2.wav" gain="0.0" id="track-7" />
        <audioelement url="3.wav" gain="0.0" id="track-8" />
        <audioelement url="4.wav" gain="0.0" id="track-9" />
        <audioelement url="5.wav" gain="0.0" id="track-10" />
        <audioelement url="1.wav" gain="0.0" id="track-11" type="outside-reference" />
        <commentquestions>
            <commentquestion id='mixingExperience'>
                <statement>What is your general experience with numbers?</statement>
            </commentquestion>
            <commentradio id="preference">
                <statement>Please enter your overall preference</statement>
                <option name="worst">Very Bad</option>
                <option name="bad"></option>
                <option name="OK">OK</option>
                <option name="Good"></option>
                <option name="Great">Great</option>
            </commentradio>
            <commentcheckbox id="character">
                <statement>Please describe the overall character</statement>
                <option name="funky">Funky</option>
                <option name="mellow">Mellow</option>
                <option name="laidback">Laid back</option>
                <option name="heavy">Heavy</option>
            </commentcheckbox>
        </commentquestions>
        <survey location="before">
            <surveyentry type="statement" id="test-1-intro">
                <statement>Example of a 'MUSHRA' style interface with hidden anchor 'zero' (which needs to be below 20%), looping of the samples, randomisation of marker labels, mandatory moving of every sample, and a forced scale usage of at least 25%-75%.</statement>
            </surveyentry>
        </survey>
        <survey location="after">
            <surveyentry type="question" id="genre-1" mandatory="true">
                <statement>Please enter the genre.</statement>
            </surveyentry>
        </survey>
    </page>
</waet>
