<?xml version="1.0" encoding="UTF-8" ?>
    <waet xmlns:xsi="http://www.w3.org/2001/XMLSchema-instance" xsi:noNamespaceSchemaLocation="test-schema.xsd">
        <setup interface="discrete" projectReturn="save.php" crossFade="0.1" poolSize="3">
            <metric>
                <metricenable>testTimer</metricenable>
                <metricenable>elementTimer</metricenable>
                <metricenable>elementInitialPosition</metricenable>
                <metricenable>elementTracker</metricenable>
                <metricenable>elementFlagListenedTo</metricenable>
                <metricenable>elementFlagMoved</metricenable>
                <metricenable>elementListenTracker</metricenable>
            </metric>
            <interface>
                <interfaceoption type="check" name="fragmentMoved" />
            </interface>
        </setup>
        <page id='test-0' hostURL="media/example/" randomiseOrder='true' repeatCount='4' loop='true' loudness="-23">
            <interface>
                <scales>
                    <scalelabel position="0">(1) Very Annoying</scalelabel>
                    <scalelabel position="25">(2) Annoying</scalelabel>
                    <scalelabel position="50">(3) Slightly Annoying</scalelabel>
                    <scalelabel position="75">(4) Audible but not Annoying</scalelabel>
                    <scalelabel position="100">(5) Inaudible</scalelabel>
                </scales>
            </interface>
            <audioelement url="0.wav" id="track-1" name="track-0" type="outside-reference" />
            <audioelement url="1.wav" id="track-2" />
        </page>
        <page id='test-1' hostURL="media/example/" randomiseOrder='true' repeatCount='4' loop='true' loudness="-23">
            <interface>
                <scales>
                    <scalelabel position="0">(1) Very Annoying</scalelabel>
                    <scalelabel position="25">(2) Annoying</scalelabel>
                    <scalelabel position="50">(3) Slightly Annoying</scalelabel>
                    <scalelabel position="75">(4) Audible but not Annoying</scalelabel>
                    <scalelabel position="100">(5) Inaudible</scalelabel>
                </scales>
            </interface>
            <audioelement url="0.wav" id="track-3" name="track-0" type="outside-reference" />
            <audioelement url="2.wav" id="track-4" />
        </page>
        <page id='test-2' hostURL="media/example/" randomiseOrder='true' repeatCount='4' loop='true' loudness="-23">
            <interface>
                <scales>
                    <scalelabel position="0">(1) Very Annoying</scalelabel>
                    <scalelabel position="25">(2) Annoying</scalelabel>
                    <scalelabel position="50">(3) Slightly Annoying</scalelabel>
                    <scalelabel position="75">(4) Audible but not Annoying</scalelabel>
                    <scalelabel position="100">(5) Inaudible</scalelabel>
                </scales>
            </interface>
            <audioelement url="0.wav" id="track-5" name="track-0" type="outside-reference" />
            <audioelement url="3.wav" id="track-6" />
        </page>
        <page id='test-3' hostURL="media/example/" randomiseOrder='true' repeatCount='4' loop='true' loudness="-23">
            <interface>
                <scales>
                    <scalelabel position="0">(1) Very Annoying</scalelabel>
                    <scalelabel position="25">(2) Annoying</scalelabel>
                    <scalelabel position="50">(3) Slightly Annoying</scalelabel>
                    <scalelabel position="75">(4) Audible but not Annoying</scalelabel>
                    <scalelabel position="100">(5) Inaudible</scalelabel>
                </scales>
            </interface>
            <audioelement url="0.wav" id="track-7" name="track-0" type="outside-reference" />
            <audioelement url="4.wav" id="track-8" />
        </page>
    </waet>
